The Soldier Who Came Back,by,Steve Foster,2019-04-10,2019
Moab is My Washpot,by,Stephen Fry,2019-03-24,2019
Keeper,by,Graham Norton,2019-03-16,2019
I Robot,by,Issac Asimov,2019-03-12,2019
Day of the Accident,by,Nuala Ellwood,2019-03-01,2019
Blood for Blood,by,Ziba MacKenzie,2019-02-20,2019
The President Is Missing,by,James Patterson,2019-02-08,2019
Cheerful Sacrifice The Battle of Arras 1917,by,Jonathan Nicholls,2019-02-05,2019
Around the World in 80 Days,by,Mark Beaumont,2019-01-26,2019
An Officer and a Spy,by,Robert Harris,2019-01-24,2019
Confessions of Felix Krull Confidence Man,by,Thomas Mann,2019-01-10,2019
