The Burglar Who Counted The Spoons,by,Lawrence Block,2015-01-06,2015
No Time For Goodbye,by,Linwood Barclay,2015-01-14,2015
Guards! Guards!: (Discworld Novel 8),by,Terry Pratchett,2015-01-29,2015
The Almond Blossom Appreciation Society (Lemons Trilogy Book 3),by,Chris Stewart,2015-02-01,2015
Bradley Wiggins: My Story,by,Bradley Wiggins,2015-02-01,2015
Telling Tales (Vera Stanhope Book 2),by,Ann Cleeves,2015-02-13,2015
Fathomless Riches: Or How I Went From Pop to Pulpit,by,Richard Coles,2015-02-25,2015
The Poisonwood Bible,by,Barbara Kingsolver,2015-03-26,2015
Live Wire (Myron Bolitar Book 10),by,Harlan Coben,2015-04-03,2015
Eric (Discworld Book 9),by,Terry Pratchett,2015-04-09,2015
The Burning Room (Harry Bosch Book 19),by,Michael Connelly,2015-04-17,2015
The Redbreast: A Harry Hole Thriller (Oslo Sequence 1),by,Jo Nesbo,2015-05-02,2015
To Kill A Mockingbird,by,Harper Lee,2015-05-09,2015
Wise Mans Fear (The Kingkiller Chronicle): 2,by,Patrick Rothfuss,2015-06-01,2015
The Woods,by,Harlan Coben,2015-06-23,2015
Moving Pictures: (Discworld Novel 10),by,Terry Pratchett,2015-06-23,2015
How I Won the Yellow Jumper: Dispatches from the Tour de France,by,Ned Boulting,2015-06-28,2015
Tell No One,by,Harlan Coben,2015-07-02,2015
Shutter Island,by,Dennis Lehane,2015-07-16,2015
Boston Noir (Akashic Noir),by,Dennis Lehane,2015-08-04,2015
Wool (Wool Trilogy 1),by,Hugh Howey,2015-08-24,2015
At Home: A Short History of Private Life,by,Bill Bryson,2015-09-09,2015
Last Days of the Bus Club: From the Author of Driving Over Lemons,by,Chris Stewart,2015-09-09,2015
Hidden Depths (Vera Stanhope Book 3),by,Ann Cleeves,2015-10-09,2015
Reaper Man: (Discworld Novel 11),by,Terry Pratchett,2015-10-17,2015
Nemesis: A Harry Hole Thriller (Oslo Sequence 2),by,Jo Nesbo,2015-11-16,2015
We Were Young and Carefree: The Autobiography of Laurent Fignon,by,Fignon Laurent,2015-12-05,2015
The Crossing (Harry Bosch 20),by,Michael Connelly,2015-12-22,2015
The Stranger,by,Harlan Coben,2015-12-29,2015
